{
  "schema_version": "1.0",
  "request_id": "fixture-publish-artifact-page",
  "helper_id": "publish-artifact-page",
  "operation": "publish-artifact-page",
  "mode": "dry_run",
  "inputs": {
    "plan_file": "tests/speckit-pro/unit/fixtures/read-only-helpers/read-only-helper-feature/plan.md",
    "entry_id": "implementation-plan",
    "content": "<!doctype html><title>Unfilled</title>"
  }
}
