{
  "schema_version": "1.0",
  "request_id": "install-health-repair",
  "helper_id": "install-health-repair",
  "operation": "install-health-repair",
  "mode": "read_only",
  "inputs": {
    "case_file": "tests/speckit-pro/unit/fixtures/installed-plugin-release/install-health-repair-cases.json",
    "case_id": "ready"
  }
}
