{
  "schema_version": "1.0",
  "request_id": "xplat-007-us3-active-path-guard",
  "helper_id": "active-path-guard",
  "operation": "active-path-guard",
  "mode": "read_only",
  "inputs": {
    "repo_root": ".",
    "case_file": "tests/speckit-pro/unit/fixtures/runner-gates/active-path-guard-cases.json",
    "case_id": "final-current-implementation",
    "xplat_008_cutover_allowed": false
  }
}
