{
  "schema_version": "1.0",
  "request_id": "fixture-artifact-selection",
  "helper_id": "select-artifact-pages",
  "operation": "select-artifact-pages",
  "mode": "read_only",
  "inputs": {
    "plan_file": "tests/speckit-pro/unit/fixtures/read-only-helpers/read-only-helper-feature/plan.md"
  }
}
