{
  "schema_version": "1.0",
  "request_id": "fixture-knowledge-update-plan",
  "helper_id": "knowledge-update-plan",
  "operation": "knowledge-update-plan",
  "mode": "read_only",
  "inputs": {
    "repo_root": "tests/speckit-pro/unit/fixtures/read-only-helpers/knowledge-empty-repo",
    "action": "init",
    "timestamp": "2026-07-14T12:00:00Z"
  }
}
