{
  "schema_version": "1.0",
  "request_id": "fixture-check-gate-preflight-coverage",
  "helper_id": "check-gate-preflight-coverage",
  "operation": "check-gate-preflight-coverage",
  "mode": "read_only",
  "inputs": {
    "gates": [
      {
        "gate": "G7",
        "command": "python3 tests/speckit-pro/run-all.py",
        "needs": []
      },
      {
        "gate": "Post: Live Evaluation",
        "command": "python3 tests/live/run-eval.py --task T042",
        "needs": [
          {
            "category": "external_side_effect",
            "target": "api.example.com model service"
          }
        ]
      }
    ],
    "inventory_actions": [
      {
        "action_id": "live-skill-eval",
        "category": "external_side_effect",
        "target": "api.example.com model service"
      }
    ]
  }
}
