{
  "schema_version": "1.0",
  "request_id": "fixture-plan-layers-feature-dir",
  "helper_id": "plan-layers-feature-dir",
  "operation": "plan-layers-feature-dir",
  "mode": "read_only",
  "inputs": {
    "feature_dir": "tests/speckit-pro/unit/fixtures/read-only-helpers/read-only-helper-feature"
  }
}
