{
  "schema_version": "1.0",
  "request_id": "xplat-008-release-readiness-ready",
  "helper_id": "release-readiness",
  "operation": "release-readiness-xplat008",
  "mode": "read_only",
  "inputs": {
    "case_file": "tests/speckit-pro/unit/fixtures/installed-plugin-release/release-readiness-cases.json",
    "case_id": "ready"
  }
}
